[
  {
    "event_id": 1,
    "node_id": 1,
    "stream_id": 1,
    "lamport": 1,
    "mono_ts_ns": 100,
    "event_kind": 1,
    "flags": 0,
    "deps_count": 0,
    "payload_len": 5,
    "payload_hash": [220,241,139,216,165,162,1,75,93,178,133,41,157,188,199,4,158,77,213,21,74,120,133,175,193,169,188,111,72,53,104,138],
    "deps": [],
    "payload": [97,108,112,104,97]
  },
  {
    "event_id": 2,
    "node_id": 1,
    "stream_id": 1,
    "lamport": 2,
    "mono_ts_ns": 101,
    "event_kind": 1,
    "flags": 0,
    "deps_count": 1,
    "payload_len": 4,
    "payload_hash": [219,154,227,192,211,240,243,255,173,231,248,112,81,59,196,215,64,248,229,11,178,168,150,190,228,239,106,12,255,154,107,145],
    "deps": [1],
    "payload": [98,101,116,97]
  }
]
